body,title,url
"
Ricardo Contreras, presidente de la Federación Mexicana de Boxeo, reconoció que aunque por ahora, Ana Gabriela Guevara ha hecho sólo promesas a las federaciones deportivas en cuestión de apoyo, la diferencia con la administración pasada, dirigida por Alfredo Castillo, es que “no viene con el ánimo de confrontación, sino de conciliación”.
El boxeo fue de los organismos más atacados por Castillo, tanto que Contreras reveló, “por cuatro años no recibimos un peso de apoyo, y nos quitaron el registro ante el Sinade. Hoy, lo hemos recuperado, tenemos la promesas de apoyo para los siguientes ciclos y eso ya es un avance”.
Pero no por eso, “tenemos que olvidar que este Gobierno tiene una política de austeridad de la cual el deporte no se puede sustraer. Entendemos que estamos en una época de ajuste, y ojalá pronto todo retome su cauce normal”.
Es por eso que los seis púgiles que van a los Juegos Panamericanos de Lima no llevan la exigencia de entregar resultados.
 



Artículo


Alexa Moreno no irá a los Juegos Panamericanos de Lima

Universal Deportes


Alexa no compitió en la última evaluación que se llevó a cabo el lunes pasado en Querétaro, lo que afectó su sumatoria de puntos de cara a Lima 2019 








“Estos boxeadores no recibieron apoyo en lo que a fogueo se refiere, nada, aquí les dimos todo lo que pudimos en cuanto a técnica y demás, pero sólo eso”, explicó el federativo.
Tan es así que el único campamento que se hizo en el exterior, “nos lo pagó la Federación de Boxeo de Rusia, llevamos a Rogelio Romero, el muchacho de la categoría de más de 81 kilos, y tres más que buscan ir a los Olímpicos de Tokio. Nosotros sólo cubrimos lo de las visas, unos 15 mil pesos, de un viaje que costó cerca de 20 mil dólares”.
Sobre la posibilidad de cerrar parcialmente el Comité Olímpico Mexicano, por la falta de recursos, Contreras espera “que eso no llegue a suceder, no lo podemos permitir. Nunca el deporte mexicano ha vivido una situación que obligue a cerrar unas instalaciones llenas de historia, como lo son las del COM, donde tanto sudor y triunfo se ha entregado a México”.
 

[[nid:1649384]
","Boxeadores mexicanos, sin apoyo para los Juegos Panamericanos",http://www.eluniversal.com.mx/universal-deportes/box/boxeadores-mexicanos-sin-apoyo-para-los-juegos-panamericanos
"El bajo nivel de audiencia de la última temporada de MasterChef puso en entredicho la continuidad de Anette Michel en la conducción, misma que se acrecentó al aparecer como titular en ‘Venga La Alegría’.
Para la edición de este año se espera el repunte del show gastronómico y los fans quieren a la conductora tapatía en su mejor versión.
Algunas de las sorpresas preparadas por la producción es el supuesto regreso de los concursantes más polémicos del programa, entre ellos Maru, Pastor, Pablo Martí, Lourdes y Geny.
Michel se mantiene en silencio respecto a la nueva temporada, lo único que se confirmó es la salida del Chef Benito Molina, quien se incorporó al programa MasterChef Latino, que se transmite a través del canal Telemundo para toda América Latina.
El éxito de las primeras emisiones de MasterChef México se debió a la frescura de la tapatía y a su sencillez por atrapar a los fans.
VER: El día que Anette Michel sufrió acoso
",Anette Michel en duda para MasterChef 2019,http://www.unionjalisco.mx/articulo/2019/06/07/espectaculos/anette-michel-en-duda-para-masterchef-2019?platform=hootsuite
"
El abuso de quien tiene poder, sobre quien está en posición vulnerable, es el eje de las injusticias de este país, pues actualmente no existe una cultura de respeto por el prójimo y menos aún por sus derechos.
El individualismo, que es la esencia de nuestra idiosincrasia, es el detonador de este grave problema.
No puede haber justicia social, como pretende lograr la “cuarta transformación”, si no se parte del respeto a los derechos humanos como eje del cambio.
Un gran avance en la lucha a favor del respeto a los derechos humanos se logró a partir de otorgársele autonomía a la CNDH, institución que tiene como misión proteger al ciudadano respecto de los abusos que pudieran nacer de las instituciones propias del Estado Mexicano. Por tanto, la CNDH no puede depender, ni estar subordinada a la misma autoridad a la que debe vigilar.
Es preocupante que al darse a conocer la renuncia de Guillermo García Alcocer como presidente de la CRE, Comisión Reguladora de Energía, el presidente de México alabó la decisión de este funcionario argumentando que “quienes no comparten su proyecto, deben optar por otra manera de trabajar”.
Esto significa no aceptar la independencia jurídica de los organismos autónomos, entre los que está la CRE, los cuales no deben estar supeditados a los criterios personales de los funcionarios públicos que ejercen cargos de liderazgo y poder en las instituciones gubernamentales.
El criterio independiente de estos organismos debe generar los equilibrios necesarios para que a partir de la pluralidad, se tomen las mejores decisiones en beneficio del país.
Sin embargo, la visión centralista que hoy impera en el nuevo gobierno considera que los contrapesos son un obstáculo en contra de la voluntad personal de quien gobierna y de inmediato, quien no se alinea, se convierte en adversario.
Tener una opinión diferente no debe significar rivalidad, sino al contrario, es otra forma de colaboración que enriquece el ejercicio de gobierno porque aporta otra visión complementaria para tomar las mejores decisiones.
Por tanto, que la vigilancia del respeto a los derechos humanos descanse en un organismo independiente del Poder Ejecutivo, aporta imparcialidad, la cual se soporta precisamente en su autonomía.
Ojalá que esta opinión expresada por el presidente de México ante la noticia de la renuncia del presidente de la CRE, García Alcocer, no esté manifestando una intención generalizada por controlar a todos los organismos autónomos y a aquellos que tienen una independencia fundamentada desde la constitución, como son los poderes: Judicial y Legislativo, que junto con el Poder Ejecutivo, que encabeza el presidente, conforman los tres Poderes de la Unión.
No sobra recordar que el Poder Judicial está conformado por la Suprema Corte de Justicia, el Tribunal Electoral, los tribunales de circuito, colegiados y unitarios, los juzgados de distrito y el Consejo de la Judicatura Federal.
A su vez, el Poder Legislativo está integrado por la Cámara de Senadores y la Cámara de Diputados, federal.
Todos los presidentes que gobernaron nuestro país en los últimos años, incluyendo a Enrique Peña Nieto, fueron respetuosos de esta autonomía y es deseable y necesario que así continúe este equilibrio institucional, que es la base del espíritu democrático del Estado Mexicano.
Sin embargo, este criterio debe abarcar a todos los organismos autónomos como la CNDH, el INE, el INAI, así como otros de gran representatividad y liderazgo público en su área de especialidad.
El desinterés presidencial por conocer de forma directa y de primera mano el informe anual de la CNDH y la problemática que rodea a los derechos humanos, puede ser interpretado como una estrategia para marcar distancia con la actual gestión de la CNDH, que preside Luís Raúl González Pérez, para no comprometerse a dar respuesta al diagnóstico presentado y menos aún, darse por enterado de su contenido.
Para un país al cual le urge construir una cultura de respeto a los derechos humanos, porque no existe y para un gobierno que tiene como reto combatir la violencia y para ello está generando cambios estructurales en su política de seguridad pública, como lo es la creación de la Guardia Nacional, es fundamental blindar toda esta transformación operativa. Para ello se requiere del apoyo y colaboración de una estructura experimentada y confiable que garantice que la lucha contra la violencia delincuencial se llevará a cabo respetando los derechos humanos.
La operación de la nueva Guardia Nacional necesitará de la mirada vigilante de una CNDH fuerte y respetada, que se convierta en su contrapeso y además, tenga la capacidad de no doblegarse ante el poder de una institución policial que nace con grandes retos y una gran exigencia de eficiencia y eficacia. Esta presión por lograr resultados rápidos, generará condiciones en las cuales la exigencia de alcanzar las metas propicie excesos y quizá hasta el riesgo de violación de derechos humanos.
Por tanto, se vuelve necesario contar con una CNDH autónoma respecto del Poder Ejecutivo, confiable y experimentada y por fuerza, distanciada de la estructura gubernamental.
¿Usted cómo lo ve?
Facebook: @Ricardo.homs1
Twitter: @homsricardo
Linkedin: Ricardo Homswww.ricardohoms.com
","Indiferencia ante el abuso, en derechos humanos",https://www.eluniversal.com.mx/articulo/ricardo-homs/nacion/indiferencia-ante-el-abuso-en-derechos-humanos
"La foto lo dijo todo: Un indígena ardía en llamas, su rostro iluminado por el fuego reflejaba el dolor, mientras sus compañeros que se oponían a un desalojo, lo miraban azorados.
Esta historia gráfica captada el 19 de septiembre del 2018, por el fotógrafo de El Gráfico, Juan Armando Martínez Argüelles, fue galardonada este viernes como “La fotografía más oportuna”, durante el Premio Nacional de Periodismo 2019, organizado por el Club de Periodistas de México A.C.
Ese miércoles, el reportero gráfico acudió a un intento de desalojo de un predio, en la colonia Juárez. Tratando de ahuyentar a policías y cargadores, uno de los invasores roció de gasolina el campamento, pero en un descuido, su ropa se impregnó de combustible, por lo que el hombre ardió en llamas.
Antes del incendio, Armando se percató de las intenciones del invasor, por lo que su olfato periodístico le indicó que algo importante iba a ocurrir. Y así pasó, cuando captó el momento del accidente que casi le cuesta la vida al individuo.
La adrenalina por los acontecimientos, el peligro del incendio, mezclada con la fascinación por captar la mejor imagen, lograron una excelente fotografía que fue elegida para la portada de El Gráfico en su edición del 20 de septiembre y a la postre, el jurado calificador del Certamen Nacional de Periodismo la eligió como la ganadora del Premio.    
Egresado de la UNAM, en el 2009 todavía quería ser cronista deportivo, pero sus amistades lo llevaron por otro camino, “tuve la oportunidad de coincidir con un compañero y su papá se dedicaba a la nota roja, desde ahí, cuando me mostraba su trabajo, quedé prendido de su profesión"".
Su padre leía El Gráfico, y como él y su hermano eran menores de edad, les escondía el periódico para que no se impactaran con las imágenes. Pero eso nunca lo detuvo.
Diez años han pasado desde que se sumergió en ese universo donde la muerte y la tragedia son el día a día, donde la realidad supera la ficción.
“Mi trabajo me gusta porque sé que es importante para la sociedad, el que documente alguien lo que realmente pasa en las calles. Mi tarea es dar a conocer estos hechos, los cuales a la larga se convierten en indicadores de dónde hay inseguridad”, explica.
Juan Armando Martínez Argüelles tiene cinco años trabajando para El Gráfico y es parte del equipo que también realiza las transmisiones en vivo del acontecer diario, desde redes sociales.
Acompañado de su familia, recibió la medalla que corona una década de trayectoria y de la cual se enorgullece. “Para hacerlo, siento que necesitas tener algo que te vibre”, puntualiza.

 
 
 

Ver esta publicación en Instagram

Una publicación compartida por El Gráfico (@elgraficomx) el 7 de Jun de 2019 a las 5:41 PDT



 
 
 

Ver esta publicación en Instagram

Una publicación compartida por El Gráfico (@elgraficomx) el 7 de Jun de 2019 a las 5:42 PDT



 
 
 

Ver esta publicación en Instagram

Una publicación compartida por El Gráfico (@elgraficomx) el 7 de Jun de 2019 a las 5:43 PDT



 
 
 

Ver esta publicación en Instagram

Una publicación compartida por El Gráfico (@elgraficomx) el 7 de Jun de 2019 a las 6:22 PDT


",,https://www.elgrafico.mx/la-roja/fotografo-de-el-grafico-gana-premio-nacional-de-periodismo-por-foto-de-hombre-en-llamas
,,https://www.facebook.com/viveusa.mx
"

El canciller Marcelo Ebrard y su equipo lograron lo que ya muchos daban por tiempo y esfuerzo perdido. Las negociaciones y promesas de endurecer por parte de México su política migratoria surtieron efecto y lograron apaciguar la furia del inquilino de la Casa Blanca. De manera indefinida ha suspendido el gobierno de Donald Trump la aplicación de aranceles comerciales a los productos mexicanos que intentaran comercializarse en Estados Unidos a partir del lunes próximo.

Pero no hay que cantar victoria: hasta el día de hoy se mantiene en el horizonte la amenaza de los aranceles a las exportaciones mexicanas hacia EU. Es una batalla en la que tan sólo se consiguió un respiro que no se sabe qué tan breve sea. Se trata de una tregua en una guerra que no hay que dar aún por perdida. Lo que sucedió durante esta semana deja claro que las negociaciones son un buen camino pero hay que tener una mayor capacidad de presión al interior de la economía estadounidense. No es precisamente con marchas como se van a solucionar este tipo de situaciones. Hay que buscar otros actores de presión cuyos intereses se alineen con México, como el del sector de los empresarios estadounidenses que dependen de las mercancías mexicanas. Hay que construir o reforzar esas redes de negocios, pues da la impresión de que Trump puede tomar este tipo de decisiones sin consecuencias para su país, siendo que por el contrario el consumidor y la industria norteamericanos también se van a ver afectados en algún modo.

Con ningún otro país se encuentra tan vinculado México como con Estados Unidos. Ni siquiera con alguno de América Latina, con los que compartimos tantas cosas en común como idioma, idiosincracia o problemas similares. Estados Unidos está tan indisolublemente unido a nuestra nación que sólo baste recordar que una buena parte de su territorio en algún momento formó parte del nuestro o que en la actualidad poco más de 30 millones de habitantes en EU mantienen algún tipo de vínculo con México, ya sea familiar o por lo menos cultural.

Lo acontecido esta semana tendría que servir de lección para el futuro. Por supuesto que la negociación tiene que darse con el gobierno estadounidense, pero al mismo tiempo buscar alianzas con otros sectores. En el Senado y la Cámara de Representantes hay legisladores que entienden la complementación que han alcanzado las economías de ambos países y por lo tanto se convierten en aliados naturales contra la imposición de aranceles. Estados y ciudades estadounidenses son también otra veta de oportunidad. Texas y California, por ejemplo, tienen en México un importante socio comercial. Trump es el mandatario estadounidense, pero hay otros sectores que fungen como enormes contrapesos. Eso debe aprovecharlo el gobierno mexicano, ahora y en situaciones futuras.
",La tregua de Donald Trump,https://www.eluniversal.com.mx/articulo/editorial-el-universal/nacion/la-tregua-de-donald-trump
,,https://www.revistaclase.mx/realeza/ya-sabemos-quien-sera-el-protagonista-del-desfile-trooping-colour-en-honor-la-reina-isabel
"Jennifer Aniston se encuentra promocionando la nueva película original de Netflix, Murder Mystery, donde comparte créditos con Adam Sandler.
Como parte de sus compromisos, la estrella de Friends visitó los estudios de Jimmy Kimmel Live en Hollywood ataviada con un elegante atuendo oscuro.
La actriz de 50 años dejó en claro que la edad es sólo un número que no define talento, belleza o sensualidad.
En esta ocasión, presumió su afilada figura con un conjunto de pantalones de vestir negros, un top de escote en V al estilo braless y un blazer verde militar.

Foto: The Grosby Group
La estrella añadió un bolso de cadena de Chanel, stilletos negros, un reloj dorado a juego con pendientes de aro grandes, un collar largo y gafas claras.
Definió sus rasgos con blush tenue, amplias pestañas negras y un poco de sombra en los párpados. 
Su rubio cabello se vio alborotado por el aire que corría a las afueras de El Capitan Entertaiment Centre, por lo que los mechones le rosaban el rostro y caían sobre sus hombros.
Visita 






Rihanna luce sus curvas con lencería dorada


La cantante anunció que esta noche se lanzará su nueva colección de ropa interior 



En la película Murder Mystery, Aniston y Sandler interpretan a una pareja casada que vacaciona en Europa, cuando se encuentran a un misterioso hombre que los invita a una reunión familiar con un anciano multimillonario en un yate.
Cuando el anciano es asesinado, la pareja se convierte en los principales sospechosos.
La première de la película está prevista para el 12 de junio bajo la participación de Adam Sandler, Luke Evans, Gemma Arterton y el mexicano Luis Gerardo Méndez.
El rodaje comenzó en junio de 2018 en Montreal, Canadá para continuar en escenarios de Santa Margherita Ligure, el Lago Como y Milán, Roma.

Foto: AFP 
Te puede interesar 






A los 53, Elizabeth Hurley presume su silueta con bikini 'animal print' 


La estrella de 'Al diablo con el diablo' está lista para el verano; presumió modelos de su propia línea de trajes de baño 



 
• ¿Ya conoces nuestro canal de YouTube? ¡Suscríbete!
",,https://www.viveusa.mx/showbiz/jennifer-aniston-conquista-hollywood-con-belleza-y-estilo-los-50-anos
"


Mercedes comenzó a trabajar en el Sistema de Transporte Colectivo (STC) Metro en marzo de 2018; después de mes y medio de conducir por una de las líneas con mayor afluencia en la capital y de realizar maniobras por un camino de 20 kilómetros, por fin se sentía cómoda en cada una de las 19 estaciones que conforman la Línea 8. Una noche de mayo de ese mismo año abordó la cabina y dio cuatro recorridos. Cuando iba a dar la quinta vuelta, al llegar a la estación Iztacalco, vio como un joven delgado, vestido con playera y short blancos, tomó impulso y se arrojó a las vías. El frenado de urgencia no fue suficiente y la unidad de 40 toneladas chocó contra el cuerpo del hombre.
 

De 2009 a 2018 se tiene el reporte de 306 muertes que ocurrieron en alguna de las estaciones que componen el Metro de la capital. Paros cardiacos, accidentes, homicidios y suicidios, están entre las causas. Pero en más de la mitad de los casos que se registraron, es decir 160, los usuarios se suicidaron, esto según un cruce de información hecho con solicitudes de información realizadas al Sistema de Transporte Colectivo (STC) Metro y al Instituto Nacional de Ciencias Forenses de la Ciudad.

Cada año, en promedio, 16 usuarios se suicidaron en las instalaciones del Metro. El año que rompió con este patrón fue 2017: 32 ciudadanos terminaron con su vida; esto representó 84% del total de las muertes que ocurrieron en esos 12 meses. Estos trenes se han convertido en un método letal y contundente para morir, explica la doctora Ángela Martínez González, miembro de la Red Mundial de Suicidólogos de México.

El perfil de los suicidas se muestra claro en los registros oficiales: 80% son hombres; la edad promedio es entre 35 y 44 años y se tiran a las vías en el segundo semestre del año, principalmente entre septiembre y octubre, según los datos entregados por el Incifo.
 
 

Martínez González asegura que estas características ayudan a tener hipótesis acerca de las causas que los llevaron a quitarse la vida; desempleo, presión familiar y social de cumplir con el rol de proveedor o deudas son otras de las razones que se pueden presentar.

Además, la elección del lugar representa otro factor importante. No es lo mismo cometer este acto en el hogar, en un lugar en el que se guarda privacidad y donde se puede esconder el hecho o hasta maquillarlo, que en un lugar público, ahí “se convierte en algo que va a impactar a más de uno”, refiere. El nivel de afectación tiene diferentes dimensiones, pero se han encontrado casos en los que se genera un nivel tan alto de estrés postraumático que afecta directamente la vida cotidiana de los que fueron testigos.

En los recuerdos de Mercedes sólo hay una imagen: el cuerpo de un hombre rebotando contra el parabrisas del tren que ella manejaba; el sonido del impacto al caer en las vías y el movimiento brusco que hizo que todo el convoy se deslizara unos centímetros y quedara varado a la mitad de la estación. “Lo único que pude hacer fue asegurar el mantenimiento de las personas que traía conmigo”, narra con la voz temblorosa. Lo que siguió aún está borroso en su memoria.
 

Sin protocolos para los conductores

El entrenamiento que reciben los operadores y encargados de la seguridad de las estaciones es poco difundido. Se tienen las estadísticas de los usuarios que mueren dentro del metro, se sabe cuántos se lanzan a las vías, pero no se conocen las medidas específicas para actuar cuando ocurre un fenómeno que atañe a la salud pública. Mercedes llevaba casi 60 días al mando de un tren del Metro y recuerda perfectamente que en su capacitación aprendió sobre averías del convoy, las partes que lo componen, qué maniobras tenía que conocer, pero nunca sobre cómo proceder frente a un suicidio.

EL UNIVERSAL solicitó una entrevista con las autoridades del STC para que detallaran cuál es la capacitacíón que reciben los conductores y el protocolo en el momento del incidente, pero hasta el cierre de esta edición no respondieron.

Esa noche de mayo de 2018, los nervios se apoderaron de Mercerdes. Su cuerpo temblaba y sólo pudo alertar al regulador sobre lo que acaba de ocurrir. Le preguntaron cómo estaba y si podía descender a ver a la víctima. Ella se negó, no tenía las fuerzas para observar el cuerpo.

Los minutos dentro de la cabina se hicieron eternos. Primero llegaron los policías bancarios, quienes le pidieron sus datos y los del tren; después llegó una jefa de estación, quien maniobró el convoy para rescatar el cuerpo. El hombre, de 20 años, estaba vivo. La familia llegó y declararon que uno de sus hermanos acababa de fallecer. En ese momento Mercedes estaba recibiendo atención médica, debido a la crisis nerviosa que presentaba.

Aunque su superior le informó que la víctima estaba viva, ella sabe que sobrevivir a la embestida de un vagón es casi imposible. Es soportar el choque de 40 toneladas que viajan a 80 kilómetros por hora. “La mayoría de los que rescatan con vida no tardan en morir. Es mucho el golpe que reciben”, narra con tristeza. Esta idea es la que la ha atormentado desde ese día. Al inicio, conciliar el sueño era casi imposible. La primera noche sólo escuchaba el golpe contra el parabrisas. Pasaron los días y la imagen del joven veinteañero comenzó a aparecer durante su rutina. De acuerdo con el protocolo que tiene la STC para estos casos, a Mercedes se le hizo un diagnóstico de reacción de estrés y decidieron darle 10 días de incapacidad.
 

En tres de las 12 líneas que componen el Metro se concentra 62% de las 306 muertes que ocurrieron de 2009 a 2018. En este conteo entran desde accidentes, homicidios, muertes naturales y suicidios. La línea 2, que corre desde Taxqueña hasta Cuatro Caminos, es la que registra el número más alto: 90 defunciones. En específico en Chabacano, la estación que enlaza la ciudad de norte a sur y de oriente a poniente con dos líneas. Ahí murieron nueve usuarios en la última década.

Intentando salvar vidas

Desde 2016 el Consejo Ciudadano para la Seguridad y Justicia de la CDMX y el STC firmaron un convenio para trabajar en el programa “Salvando vidas”, y así evitar los suicidios en el Metro. Este proyecto busca generar conocimiento de los factores que influyen para tomar una decisión de este tipo y poder identificar desde el inicio a los probables suicidas.

En la última década los suicidios tuvieron picos como los de 2017, año en el que se lanzaron a las vías 32 usuarios, pero también hay periodos que no llegan ni al doble dígito; en 2012 se registraron siete suicidios, lo que representó apenas 28% del total de los fallecimientos.

Para la presidenta de la Red Mundial de Suicidología lo más relevante es apoyar a todos los que hayan tenido un vínculo con el que cometió el acto. “Es un señalamiento que se le tiene que hacer a las autoridades del Metro. Si bien existe el programa llamado “Salvemos Vidas”, éste no involucra a los conductores”, dice Martínez

Además, también es importante crear un diagnóstico de las estaciones con mayor prevalencia, pues las medidas físicas que se tomen tienen que ir acorde a estos lugares, asegura la especialista.

En mayo de 2019 se cumplió un año desde la noche en la que Mercedes vio como un joven se lanzó contra el tren que conducía. Las secuelas aún las vive. Las pesadillas llegan algunas noches, son minutos en los que aún escucha el golpe contra el convoy, y cuando vuelve a llegar a la estación de Iztacalco su cuerpo se estremecece tan sólo de ver que algún usuario cruza la línea de seguridad.
","Hombres, 80% de los que se suicidan en el Metro",http://www.eluniversal.com.mx/metropoli/cdmx/hombres-80-de-los-que-se-suicidan-en-el-metro
