body,title,url
"
Texto: Elisa Villa RománDiseño web: Miguel Ángel Garnica
 

Compara el antes y después deslizando la barra central

(clic aquí para ver más grande)
 

La totoaba, además de la vaquita marina, es uno de los animales del Alto Golfo de California que está en peligro de extinción. Su vulnerabilidad viene de la pesca desmedida –e ilegal– por su alto valor en el mercado.
En el día Internacional de la lucha contra la pesca ilegal, no declarada y no reglamentada, recordamos cómo se cazaba la totoaba a principios del siglo pasado cuando aún estaba permitido.
Aunque en los años 20 ya se tenía registro de la sobrepesca de este animal marino, fue hasta 1940 que el gobierno mexicano implementó medidas de protección. 
De acuerdo con la Organización de las Naciones Unidas para la Alimentación y la Agricultura, la pesca ilegal es responsable de que actualmente se pierdan hasta 26 millones de toneladas de pescado al año, con un valor económico de 10 a 23 mil millones de dólares e incalculables costos ambientales.
Esta visión era diferente el siglo pasado. La carne de totoaba era altamente demandada en Estados Unidos y varias regiones de México, donde su precio iba de los 20 centavos por kilogramo al inicio de la temporada y terminaba en cinco centavos.
Los cardúmenes en el Alto Golfo de California eran tan grandes que rompían las hélices de las lanchas, según testimonios de pescadores de los años 20. En la foto, pescadores de los años 50 golpean un pez totoaba con un palo a bordo de su embarcación. Foto: Archivo Casasola. Fuente: Mediateca INAH.
“En aguas cercanas a Guaymas, Sonora, empiezan a llegar como todos los años entre el otoño y el invierno, grandes cardúmenes de totoaba, pescado de muy buena calidad, de gran tamaño. Los pescadores locales regresan con fuertes cargamentos diariamente”.
Ahí, a la vista de todos, se gestaba una catástrofe ambiental que décadas más tarde pondría en riesgo la vida marina de la zona.
Así lo describió un reportero de EL UNIVERSAL, en una nota del 29 de octubre de 1924:
“Por otra parte, los buches (vejiga natatoria) de ciertos peces que aquí no se utilizan en las comidas, los compran agentes de casas exportadoras del Asia pagándolos a cuatro dólares el kilo, con lo que los pescadores redondean sus ganancias. Ya comienzan a hacerse las primeras remesas de esos buches”.
La situación de Guaymas no era prometedora. El mismo corresponsal documentó que la sequía había dejado grandes pérdidas agrícolas y que la actividad económica se inclinó hacia la pesca.
Fueron tiempos difíciles y el país se recuperaba de la Revolución, guerra terminada sólo cinco años atrás. No hay conflicto sin antecedentes ni razones.
Para 1925 ya se hablaba abiertamente de la gran demanda que la totoaba tenía en China y Estados Unidos.
La Totoaba (Totoaba macdonaldi) es una especie de pez que habita solamente en el Golfo de California (es endémica) y está incluida en el Apéndice I de la Convención sobre el Comercio Internacional de Especies Amenazadas de Fauna y Flora Silvestres (CITES por sus siglas en inglés), por lo que su movimiento transfronterizo solo se permite con fines de investigación y educación. Además, esta especie se encuentra enlistada en la norma NOM-059-SEMARNAT-2010 bajo la categoría de “En Peligro de Extinción”, según datos de PROFEPA (2018). En la foto, pescadores cargan un tronco con pescados totoaba en bahía de Kino, Sonora. Foto: Archivo Casasola. Recuperada de la Mediateca del INAH.
“El artículo adquiere mayor demanda de año en año y es así que su precio aumenta también progresivamente. El buche exportado al continente amarillo (sic) se adquiere aquí, en Guaymas, el lugar donde se efectúan las transacciones de mayor importancia”.
Un pescador le dijo al reportero que “unos americanos” habían recorrido las aguas donde abundaba la totoaba y que esperaban establecer una empresa de mariscos.
Según los empresarios, de la zona podían extraer hasta medio millón de peces al día con dos grandes empacadoras.
De hecho, en varias ciudades de Estados Unidos como Los Ángeles o El Paso, tenían un particular interés sobre Guaymas, Sonora, para hacer negocios o como lugar de descanso.
“De las tres citadas y de otras varias, en el término de una semana se han recibido solicitudes en la Cámara de Comercio. De Los Ángeles se piden detalles sobre el lugar como centro para la caza y pesca. De El Paso, los solicitan para la exportación de totoaba”, se leía en EL UNIVERSAL de los años 20.
En una nota publicada el 3 de enero de 1926 se describe cómo los barcos transportan varias toneladas de totoaba con destino a Asia, donde el buche de este pescado es considerado un símbolo de estatus y poderío económico. Fuente: Hemeroteca EL UNIVERSAL.
En enero de 1926 Estados Unidos prohibió la pesca en sus aguas durante cuatro años y los mares mexicanos comenzaron a sobreexplotarse.
El Mar de Cortés o Golfo de California fue el encargado de surtir la demanda de mariscos a los mercados estadounidenses. El pez más solicitado era la barracuda, del que partían camiones repletos de carne.
Quien escribió esta noticia opinó: “cuando menos debería procurarse refrigerar dentro de nuestro territorio los productos que están extrayéndose del Golfo de Cortés. Con ello ganaría la región, ya que se establecería la industria hielera”.
A principios de los años 30 iniciaron las primeras vedas a la pesca de totoaba. De hecho, una disposición a nivel federal de 1933 decía que únicamente las sociedades cooperativas de pescadores podrían ejercer esa industria con una licencia.
Sin embargo, era muy difícil que los pescadores formaran cooperativas y aunque se hicieron esfuerzos por otorgar permisos a pequeños productores, fueron las empresas quienes más ganaron.
En el pueblo de Guaymas, una nueva compañía empezó a operar en diciembre de 1933 A diferencia de sus competidoras, no transportaban la totoaba en ferrocarril hacia Estados Unidos.
Tenían un camión con capacidad de cuatro toneladas que hacía dos viajes a Los Ángeles cada semana, en un trayecto de cuarenta horas.
Después se supo que otra empresa contaba con diez barcos de motor que llevaban las totoabas de Sonora a Estados Unidos, donde tenían alta demanda.
Algunos cargamentos de totoaba llegaron a la Ciudad de México, donde el pescado comenzaba a popularizarse desde mediados de los años 30. En la imagen, un pescador lanza una red desde un barco en Bahía Kino, Sonora Foto: Archivo Casasola. Fuente: Mediateca INAH.
Así, la explotación desmedida continuó durante los siguientes años con vedas intermitentes de 1940 a 1955 para proteger la reproducción de la totoaba.
Para 1975 se vedó permanentemente la captura del pez en el Golfo de California, de acuerdo con el estudio “crecimiento y mortalidad de la Totoaba macdonaldi del alto golfo de California”.
Pero no fue suficiente. La totoaba se seguía pescando de forma ilegal y para finales de los años 80 los efectos de la pesca desmedida se hacían notar, según publicaciones periódicas de la época.
En 1991 la totoaba fue declarada especie en peligro de extinción. La vaquita marina, el único mamífero marino originario de México, corrió con la misma suerte.
Aunque no se le caza directamente, las redes de los pescadores de totoaba invaden su hábitat y quedan atrapadas, donde después de algún tiempo mueren.
“La totoaba sólo es encontrada en una extensión marítima comprendida entre el Norte de la Baja California y las aguas de Topolobampo. De esta especie hay ejemplares de gran tamaño y peso. Y desde hace algunos años tiene buen mercado en varias ciudades del país vecino”. EL UNIVERSAL. 24 de octubre de 1935. Foto: Archivo Casasola. Fuente: Mediateca INAH. 
No basta con prohibir la pesca ilegal: se debe detener todo tipo de pesca si se desea salvar a estos animales de la extinción, de acuerdo con un reporte del Comité Internacional para la Recuperación de la Vaquita.
Según el comité, para que las medidas sean efectivas se debe prohibir a los pescadores el transporte, posesión y desplegado de redes en zonas no permitidas para la pesca.
Durante los primeros años del nuevo milenio, organizaciones no gubernamentales hicieron varios esfuerzos por conservar a las especies amenazadas directa e indirectamente por la pesca desmedida.
Ya no sólo era el problema de la pesca ilegal. Según reportes del año 2002, el agua de los cultivos en California retornaba al Mar de Cortés con un alto grado de salinidad y contaminación, dañando la fauna marina.
En 2018, la Procuraduría Federal de Protección al Ambiente (PROFEPA) aseguró 21 vejigas natatorias de Totoaba (Totoaba macdonaldi), en el área de paquetería de la Terminal 1 del Aeropuerto Internacional de la Ciudad de México (AICM), los cuales provenían de la ciudad de Mazatlán y tenían como destino China. Foto: Archivo EL UNIVERSAL. 
Además, el lucrativo negocio de la totoaba fue aprovechado por el crimen organizado. De acuerdo con una investigación publicada por EL UNIVERSAL en 2016, el empresario Kam Wing Chan utilizaba su mueblería en Estados Unidos para traficar la vejiga natatoria de la totoaba. Fue atrapado en 2015.
 

 
En algún momento la totoaba detonó la actividad económica al norte del país. Hoy se sabe que cada buche cuesta alrededor de 8 mil dólares por kilogramo en México, pero al llegar a Asia alcanzaba los 60 mil.

Nuestra foto principal es un pescador a bordo de un barco, sacando el anzuelo a un pez totoaba. La foto comparativa antigua retrata a un grupo de pescadores cargando pescado totoaba en transportes. Ambas son de 1950 pertenecen a la mediateca INAH. La foto a color es de 2017, cuando la PROFEPA aseguró 375 buches de totoaba. Crédito: NTX y PROFEPA.
Fuentes:
Hemeroteca EL UNIVERSAL
Fototeca EL UNIVERSAL
Mediateca INAH
“Día Internacional de la lucha contra la pesca ilegal, no declarada y no reglamentada, 5 de junio”, artículo de la Organización de las Naciones Unidas
“Crecimiento y mortalidad de la Totoaba macdonaldi del alto golfo de California”, artículo del Centro Regional de Investigación Pesquera de Ensenada, B.C.
Reportaje “Totoaba, un pez mexicano más caro que la cocaína”. Acceso: https://bit.ly/2wDrGBA
 
",Totoaba: cien años de pesca y tráfico ,https://www.eluniversal.com.mx/mochilazo-en-el-tiempo/totoaba-cien-anos-de-pesca-y-trafico
"
Texto: Susana Colin y Elisa VillaDiseño web: Miguel Ángel Garnica
 

Compara el antes y después deslizando la barra central
(da clic para ver más grande)

Nezahualcóyotl se construyó sobre una tierra salada donde no se podía sembrar, tan seca que se levantaban nubes de polvo y tan lejana que sus habitantes eran excluidos.
Durante años cargó con el estigma y la mala fama de una ciudad peligrosa, concepción que estuvo presente en la prensa nacional y provocaba justificada indignación de sus habitantes:
“A cada rato vienen que periodistas extranjeros, sacan fotografías de lo peor y nosotros los dejamos. Pero nunca dicen: tomen un dinerito para que se ayuden”.
La nota de abril de 1980 presenta el testimonio de una mujer que vive en Neza, indignada por el trato que recibían de los medios de comunicación.
Estos publicaban cosas como: “en el lugar no hay más que podredumbre y miseria”. “Es un dormitorio, un centro de refugiados”. “Por eso nadie los toma en cuenta”.
El papel de los medios de comunicación en la construcción del imaginario popular ha creado un sesgo en cómo percibimos a los demás.
 “No nada más es productora de basura, también lo es de violencia, desempleo, angustia, miseria, frustración…”, se lee en una nota publicada el 21 de abril de 1980, en EL UNIVERSAL.

Para el cronista Germán Aréchiga, la atención de la sociedad se concentró en las difíciles condiciones de vida en Nezahualcóyotl, pero no en sus causas, mucho menos en sus consecuencias futuras.
“Gran parte de la mala fama y de la idea que se tiene de Nezahualcóyotl como un lugar peligroso es responsabilidad de la prensa. La miseria y las complicadas condiciones de vida no eran exclusivas de este lugar”, dice.
Nezahualcóyotl en 1980.  Durante muchos años las condiciones del terreno donde habitan los pobladores de Nezahualcóyotl fueron motivo de mala fama. En primavera había tolvaneras, en época de lluvias era un lodazal. Archivo EL UNIVERSAL.
Hace cien años el sitio estaba cubierto por el Lago de Texcoco, que era de agua salada a diferencia de sus homólogos Xochimilco y Chalco, donde abundaba el cultivo en chinampas.
Fue durante la Nueva España que iniciaron los trabajos de desecación del lago, mismos que concluyeron durante el porfiriato con la justificación de que la capital —construida prácticamente sobre el agua— se inundaba constantemente.
 



Opinión


Lago de Texcoco: De pulmón a desierto de sal

Mochilazo en el tiempo


Los habitantes cercanos al Lago de Texcoco dicen que este gran vaso lacustre no debe morir, que debe ser rescatado por su importancia ecológica y su cercanía a la capital. Hoy recuerdan poco de él, de cuando sus abuelos decían que los patos abundaban aquí 







Así inició la creación de este desierto de sal que se fue poblando poco a poco, cuando vivir en la Ciudad de México se volvió insostenible.
Nota publicada el 30 de noviembre de 1922 en EL UNIVERSAL donde se argumenta por qué la desecación del Lago de Texcoco sería un desastre. 

Según los investigadores Ekkehard Buchhofer y Adrián Aguilar, los primeros habitantes se asentaron durante los años cuarenta porque el valor del suelo y el costo de las rentas en el entonces Distrito Federal eran muy altas y se prohibió la creación de nuevos fraccionamientos residenciales.
Poblar el ex vaso de Texcoco se convirtió en la tarea de los nuevos vecinos de la naciente Ciudad Neza.


Nezahualcóyotl en 1968. Largas filas para abordar los camiones conocidos como ""chimecos"" en Nezahualcóyotl. Imagen: Centro de Información y Documentación de Nezahualcóyotl. Foto: Centro de información y documentación de Nezahualcóyotl/Cortesía.
Este espacio, al haber sido parte de un lago, era propiedad del gobierno federal. Sin embargo, otra versión dice que los dueños eran ejidatarios de Chimalhuacán.
De acuerdo con Héctor Quiroz, profesor de Urbanismo en la UNAM, la poca claridad del estatus jurídico de las tierras fue el contexto perfecto para la venta fuera de toda regulación.
“La gente pagaba el terreno a plazos semanales o mensuales. Debido a la irregularidad del mercado inmobiliario, en algunos casos después de un tiempo llegaban los verdaderos dueños reclamando su propiedad”.
“Había muchos fraudes y engaños, incluso la constante amenaza de que paracaidistas se apropiaran de los espacios, es una historia por un lado heroica y por el otro triste y violenta, llena de abusos”.
Nezahualcóyotl en 1980. “Ya que llegamos allá era toda la libertad, tanto de caminar como de hasta donde nuestros ojos veían”, recuerdan sus habitantes. Archivo EL UNIVERSAL.
Doña Benita Ortiz llegó a Neza cuando tenía 13 años, en 1962. Su familia se asentó en la colonia Virgencitas.
“¿No le pareció muy difícil irse a vivir en esas condiciones?” — preguntamos a la señora Benita Ortiz. — “No, porque yo soy de provincia. Allá nos alumbrábamos con un frasco con petróleo y una mecha que le prendíamos. Volví a mi niñez”.
Ella y su familia migraron desde Guanajuato para vivir en Azcapotzalco y más tarde en la colonia Puebla.
Su papá, trabajador del entonces Departamento del Distrito Federal, supo de la venta de terrenos en el ex vaso del Lago de Texcoco y adquirió uno.
Nezahualcóyotl en 1980. Durante varias décadas muchas colonias no contaban con calles pavimentadas.En los ochenta se desarrollaron las más importantes obras viales y de infraestructura. Archivo EL UNIVERSAL.
Los recuerdos de esas primeras noches en su nuevo hogar siguen vivos en la mente de doña Benita: “era toda la libertad de caminar hasta donde nuestros ojos veían”.
El terreno era un gran llano donde se asomaban algunas casas separadas unas de otras y canales de aguas negras que desembocaban en los restos del Lago de Texcoco.
Los nuevos habitantes venían de todas partes: de Hidalgo, Michoacán, Guanajuato, Tlaxcala y Oaxaca, incluso de la zona central de la Ciudad de México.
Sin servicios básicos, acarreaban agua de la hoy Avenida Neza. Había que lanzar el recipiente atado a un lazo para alcanzar el líquido. No había drenaje, mucho menos luz.
Nezahualcóyotl en 1980. “Cuando era niño disfrutaba de las amplias calles y si la tuya no estaba pavimentada los vecinos que tenían banqueta te decían que tu vivías en un pueblito”, recuerda Alberto Ochoa, quien vivió 23 años en Neza. Archivo EL UNIVERSAL.
Todos buscaban vivir en mejores condiciones cerca de la ciudad. Primero levantaron sus jacalitos o habitaciones sencillas. Después pasaron a construir las calles, las escuelas, incluso el drenaje.
Para llevar electricidad a sus casas cada familia conectaba un largo cable a un transformador que toda la comunidad había comprado. Los vecinos se organizaban para reclamar servicios básicos al gobierno del Estado de México.
Nezahualcóyotl en 1980. La gente que llegó a Neza contribuyó a la construcción de calles y avenidas. Archivo EL UNIVERSAL.

El 23 de abril de 1963 se inauguró oficialmente Nezahualcóyotl de Texcoco. Solo unos años más tarde, la zona contaba con 600 mil habitantes, de acuerdo con datos del Inegi.
En esa etapa se delimitaron los predios y las calles, cuya traza se mantiene hasta nuestros días. El urbanista Héctor Quiroz dice que no conoce otra ciudad igual de poblada y a la vez tan ordenada.
“Calles rectas, manzanas cuadradas, lotes uniformes. ¡Es impresionante!”, apunta. “[Nezahualcóyotl] es más ordenado que sectores construidos de manera planificada”.
Nezahualcóyotl en 1970. El cableado de luz en Nezahualcóyotl estaba instalado en las nacientes colonias de manera provisional. Foto: Centro de información y documentación de Nezahualcóyotl (Cidne)/Cortesía
Este municipio del Estado de México tiene cinco décadas de historia y más de un millón de pobladores, distribuidos en las zonas centro, oriente y norte.

Doña Imelda Martínez es habitante de ésta última. Llegó a Neza a finales de los años 80 cuando salió de su hogar familiar en La Providencia, a unos minutos de Nezahualcóyotl.
Un día escuchó que estaban vendiendo terrenos sobre la Avenida Central, por donde hoy pasa la línea B del metro.
“Ahí llegamos nosotros. Todo eran montones de tierra y nunca nos imaginamos que llegaría a ser como es hoy”.
Los vecinos de su cuadra decidieron que cada quien pondría su banqueta, pero no toda la gente se ponía de acuerdo.
Fue hasta que el extinto Departamento de Obras Públicas homologó las banquetas que cada familia había puesto y después pavimentaron.
“Viví mi infancia en La Providencia y creía que era la mejor colonia del mundo. Ahora ya oigo cada cosa de allá…”, dice doña Imelda cuando se toca el tema de la inseguridad en Neza.
“Yo creo que [la violencia ocurre] donde sea, pero uno trata de vivir sin ese temor. Seguir haciendo una vida, porque si no, imagínate”. Para ella, la violencia se acabaría con educación y valores fomentados en casa.
Hoy atiende un pequeño negocio familiar y agradece que siempre se ha llevado bien con sus vecinos; algunos provienen de Puebla y a veces le comparten pan y cemitas tradicionales.
“Finalmente ves y aprendes cultura, otras formas de pensar y otra comida”.
La avenida Tepozanes, en Ciudad Nezahualcóyotl, a inicios de los setenta. En el fondo se aprecian el Volcán Guadalupe y el Cerro Tecuatzin, situados en los límites entre Iztapalapa y Tláhuac. Foto: Centro de información y documentación de Nezahualcóyotl (Cidne)/Cortesía.
Para Germán Aréchiga, cronista de Ciudad Neza, la gente que llegó a este municipio es trabajadora. “Que las condiciones del contexto no ayudaran es otra cosa, pero la gente siempre hizo su mayor esfuerzo, su lucha”.
Siempre se destacó la miseria y las precarias condiciones de vida, pero no eran exclusivas de Nezahualcóyotl. Informes señalan que desde hace diez años se ha reducido el número de personas en situación de pobreza.
Además el número de personas que trabajan en la informalidad ha disminuido en el mismo periodo de tiempo, de acuerdo con el Informe Anual sobre la Situación de Pobreza y Rezago Social en Nezahualcóyotl, del Coneval.
De la Neza de los años 60 y 70 sólo queda el recuerdo. Las precarias casitas ahora son residencias estables.
“Esto no fue de un día para otro, es una secuencia de acciones las que hicieron pasar de una ciudad miseria a un centro de distribución regional”, dice Aréchiga.
Este municipio celebra su propia Guelaguetza, carnavales y todo tipo de festivales a lo largo del año.
Ivonne García, gestora intercultural por la UNAM, nació y creció en la Neza de los años 90 y ha sido testigo de la fuerte organización y diversidad cultural de su comunidad.
Algunos de sus vecinos venden chocolate en agua, tlayudas, pan de yema y otros productos. Para ella es común que en el transporte público se escuchen conversaciones en lenguas indígenas.

Imagen de 1994. Los tianguis en Neza son espacios de encuentro, convivencia e intercambio cultural. Según Ivonne García, gestora intercultural, ahí puedes encontrar productos de otros lugares del país. Archivo EL UNIVERSAL.
“Neza es la capital cultural alternativa”, dice Lupus, un artista urbano y fundador del colectivo Neza Arte Nel. Cree que el poeta prehispánico Nezahualcóyotl influye para que la pintura, la poesía, la música y el teatro existan en la vena creativa de su municipio.
“Levantas una piedra y encuentras un artista”, dice y sonríe. Aquí el arte es una forma de reivindicarse frente al estigma de ser un espacio marginal, pobre y violento.
A pesar de la “mala fama” que ha seguido a Ciudad Nezahualcóyotl desde su comienzo, de la ola de asaltos, desapariciones y crímenes —que ocurren en la capital misma— persiste un fuerte sentido de orgullo por parte de sus habitantes.
El trabajo de Neza Arte Nel se centra en las realidades y las visiones otras que los rodean. Este colectivo, conformado por David Azael, Max Man, King Piral, El Venado y Lupus, hicieron una intervención en uno de los basureros de Ciudad Nezahualcóyotl en marzo del 2018. Archivo EL UNIVERSAL.

No es para menos, ellos levantaron de la nada una ciudad con sus propias manos:
“Fueron los ciudadanos que con su esfuerzo construyeron esta ciudad; fue el costo de una generación que se sacrificó”, dice Héctor Quiroz. En su opinión, las valoraciones estéticas salen sobrando.
“Cuando uno conoce cómo surgió Neza y cómo ha mantenido su capacidad de organización, los habitantes son hasta dignos de admiración por lo que hicieron”, concluye.
Nezahualcóyotl en 1980. Así de la nada fueron creando sus propios espacios culturales y deportivos. Archivo EL UNIVERSAL.
 

Nuestra fotografía principal muestra la avenida Chimalhuacán desde el Palacio Municipal de Nezahualcóyotl, es de los años 70 y pertenece al archivo de este diario. Las fotografías comparativas retratan el cruce de las avenidas López Mateos y Pantitlán. La antigua es una cortesía del Centro de información y documentación de Nezahualcóyotl (Cidne), la actual es de EL UNIVERSAL.
Fuentes
Hemeroteca/Fototeca EL UNIVERSAL
Entrevistas con Germán Aréchiga, Benita Ortiz, Daniela Tovar, Ivonne García, Lupus, Héctor Quiroz, Imelda Martínez Trejo y Alberto Ochoa.
“Nezahualcoyotl: Planeación urbana y ordenación espacial e la periferia de la Ciudad de México” de Ekkehard Buchhofer y Adrián Guillermo Aguilar, Instituto de Geografía de la UNAM, 1983.
Cuaderno estadístico municipal de Nezahualcóyotl, edición 2000. Inegi
Informe Anual sobre la situación de Pobreza y Rezago Social, 2018. Coneval
Gaceta municipal de gobierno. Publicación oficial del Ayuntamiento de Nezahualcóyotl 2019-2021
“Construcción social del espacio urbano: Ecatepec y Nezahualcóyotl. Dos gigantes del oriente”, investigación de Maribel Espinosa Castillo y Mario Bassols Ricárdez. UNAM, 2011
 
",Neza: la ciudad que se construyó sobre un desierto,https://www.eluniversal.com.mx/mochilazo-en-el-tiempo/neza-la-ciudad-que-se-construyo-sobre-un-desierto
,General Motors prepara un rival para Jeep Wrangler ,http://www.eluniversal.com.mx/autopistas
,,https://www.tangible-eluniversal.com.mx/que-es-lupus-la-enfermedad-que-tiene-selena-gomez
